{
  "artifact_id": "claim-qc-release-v0.1",
  "artifact_type": "ClaimArtifact.v0",
  "schema_version": "v0",
  "claim_text": "The qc-release simulation run satisfies the hospital lab QC release temporal policy under stated assumptions.",
  "claim_kind": "temporal_claim",
  "status": "CertificateChecked",
  "assumption_set_ref": "as-labtrust-qc-v0.1",
  "source_span_refs": ["span-qc-release-spec-1"],
  "formal_statement": "G (release_ready -> F[0,24h] verified)",
  "certificate_refs": ["cert-trace-qc-release-v0.1"],
  "runtime_receipt_refs": ["receipt-qc-release-run-001"],
  "created_at": "2026-05-16T12:05:00Z",
  "producer": "labtrust-gym",
  "producer_version": "0.1.0",
  "source_repo": "https://github.com/fraware/LabTrust-Gym",
  "source_commit": "aaaaaaaaaaaaaaaaaaaaaaaaaaaaaaaaaaaaaaaa",
  "signature_or_digest": "sha256:2222222222222222222222222222222222222222222222222222222222222222"
}
